{
  "schema_version": 1,
  "artifact": {
    "kind": "model",
    "launchable": true,
    "session_eligible": true,
    "directory_name": "Ornith-1.5-35B-A3B-MLX-4bit",
    "format": "mlx",
    "source": { "provider": "huggingface", "repository": "ornith-ai/Ornith-1.5-35B-A3B-MLX-4bit" },
    "payload_bytes": 20937965568
  },
  "capabilities": {
    "native_context_tokens": 262144,
    "configured_context_tokens": 262144,
    "extended_context_tokens": 1000000,
    "context_source": { "file": "config.json", "json_pointer": "/max_position_embeddings" },
    "modalities": ["text"],
    "context_floor_100k_tokens": 200000,
    "claude_autocompact_tokens": 200000
  },
  "profiles": [
    { "alias": "ornith-1.5-35b", "backend": "rapid", "thinking": false, "tool_parser": "hermes", "reasoning_parser": null, "qualification": "tested" },
    { "alias": "ornith-1.5-35b-thinking", "backend": "rapid", "thinking": true, "tool_parser": "hermes", "reasoning_parser": "qwen3", "qualification": "untested" }
  ],
  "acquisition": { "status": "complete", "producer": { "name": "local-agents", "version": "0.13.7" } }
}
