{
  "schema_version": 1,
  "artifact": {
    "kind": "model",
    "launchable": true,
    "session_eligible": true,
    "directory_name": "Small-32k-MLX-4bit",
    "format": "mlx",
    "source": { "provider": "huggingface", "repository": "example/Small-32k-MLX-4bit" },
    "payload_bytes": 4294967296
  },
  "capabilities": {
    "native_context_tokens": 32768,
    "configured_context_tokens": 32768,
    "context_source": { "file": "config.json", "json_pointer": "/max_position_embeddings" },
    "context_floor_100k_tokens": 0,
    "claude_autocompact_tokens": null
  },
  "acquisition": { "status": "complete", "producer": { "name": "local-agents", "version": "0.13.7" } }
}
