{
  "schema_version": 1,
  "artifact": {
    "kind": "model",
    "launchable": true,
    "session_eligible": true,
    "directory_name": "KAT-Coder-V2.5-Dev-OptiQ-4bit",
    "format": "mlx",
    "source": {
      "provider": "huggingface",
      "repository": "mlx-community/KAT-Coder-V2.5-Dev-OptiQ-4bit",
      "revision": "0000000000000000000000000000000000000000"
    },
    "payload_bytes": 21474836480
  },
  "capabilities": {
    "native_context_tokens": 262144,
    "configured_context_tokens": 262144,
    "context_source": {
      "file": "config.json",
      "json_pointer": "/text_config/max_position_embeddings"
    },
    "context_candidates": [
      {
        "file": "config.json",
        "json_pointer": "/text_config/max_position_embeddings",
        "value": 262144
      }
    ],
    "modalities": [
      "text"
    ],
    "context_floor_100k_tokens": 200000,
    "claude_autocompact_tokens": 200000
  },
  "profiles": [
    {
      "alias": "kat-coder-optiq",
      "backend": "rapid",
      "thinking": false,
      "tool_parser": "qwen",
      "reasoning_parser": null,
      "effort": "high",
      "qualification": "tested"
    }
  ],
  "runtime_qualification": {
    "tested_safe_context_tokens": null,
    "server_context_tokens": 262144,
    "runtime": "rapid-mlx 0.12.18",
    "quantization": "mlx-optiq-4bit",
    "hardware": "M4 Max 128GB",
    "co_resident_models": [],
    "test_date": "2026-09-05",
    "evidence": "Interactive session with locally routed auto-mode classifier; server reported context_window 262144 on /v1/models."
  },
  "acquisition": {
    "status": "complete",
    "completed_on": "2026-09-04",
    "producer": {
      "name": "local-agents",
      "version": "0.13.7"
    }
  }
}
